<?xml version="1.0" encoding="UTF-8"?>
<!DOCTYPE test_proc SYSTEM "../../DTDs/test_proc.dtd">

<test_proc name="tp_0091_asw_pus_tc_6_2_write_bytes_to_0x41020080">
	<step name="6_2_write_bytes_to_0x41020080" id="0" prev_step_idref="NULL" output_idref_from_prev_step="NULL" mode="continuous">
		<inputs>
			
			<input_level_2 name="tc_6_2" ifRef="0" delay_value="120" delay_unit="miliseconds">
				<level2 format="TC_Formats/Level2/st06/asw_pus_tc_6_2_format.xml"/>
				<app_to_level2 export="STEPS_XML/INPUTS/tc_6_2/tc_6_2_write_bytes_to_0x41020080.xml"/>
				<level1 format="DEFAULT"/>
				<level2_to_level1 export="TC_Formats/Lv2_To_Lv1/st06/asw_pus_tc_6_2_to_asw_pus_v2_tc_ack_0b1001.xml"/>
				<level0 format="DEFAULT"/>
				<level1_to_level0 export="DEFAULT"/>
			</input_level_2>
		
		</inputs>
		<outputs checkmode="all" valid_time_interval_value="2000" valid_time_interval_unit="miliseconds">
			<output_level_1 name="tm_1_1" id="0" ifRef="0">
				<level1 format="DEFAULT"/>
				<level1_filter apply_def_filter="yes" extra_filter="TM_Filters/Level1/st01/asw_pus_v2_tm_1_1_filter.xml"/>
				<level0 format="DEFAULT"/>
				<level1_from_level0 import="DEFAULT"/>
				<level0_filter apply_def_filter="yes" extra_filter="NULL"/>
			</output_level_1>
			<output_level_1 name="tm_1_7" id="1" ifRef="0">
				<level1 format="DEFAULT"/>
				<level1_filter apply_def_filter="yes" extra_filter="TM_Filters/Level1/st01/asw_pus_v2_tm_1_7_filter.xml"/>
				<level0 format="DEFAULT"/>
				<level1_from_level0 import="DEFAULT"/>
				<level0_filter apply_def_filter="yes" extra_filter="NULL"/>
			</output_level_1>
		</outputs>			
	</step>
</test_proc>
