<?xml version="1.0" encoding="UTF-8"?>
<!DOCTYPE test_proc SYSTEM "../../DTDs/test_proc.dtd">

<!--

ID: TP_0140_ASW_PUS_TC_6_5_READ_BYTES_FROM_0x40001000_TO_0x4000103F
Description:

The test checks that telecommand TC(6,5) to read 64 bytes from memory address
0x40001000 to 0x4000103F is executed correctly and the TM (6,6) with the
expected data is received.

-->

<test_proc name="TP_0140_ASW_PUS_TC_6_5_READ_BYTES_FROM_0x40001000_TO_0x4000103F">
	<step name="tc_6_5_read_bytes_from_0x40001000_to_0x4000103F" id="0" prev_step_idref="NULL" output_idref_from_prev_step="NULL" mode="continuous">
		<inputs>
			
			<input_level_2 name="tc_6_5" ifRef="0" delay_value="120" delay_unit="miliseconds">
				<level2 format="TC_Formats/Level2/st06/asw_pus_tc_6_5_format.xml"/>
				<app_to_level2 export="STEPS_XML/INPUTS/tc_6_5/tc_6_5_read_bytes_from_0x40001000_to_0x4000103F.xml"/>
				<level1 format="DEFAULT"/>
				<level2_to_level1 export="TC_Formats/Lv2_To_Lv1/st06/asw_pus_tc_6_5_to_asw_pus_v2_tc_ack_0b1001.xml"/>
				<level0 format="DEFAULT"/>
				<level1_to_level0 export="DEFAULT"/>
			</input_level_2>
		
		</inputs>
		<outputs checkmode="all" valid_time_interval_value="2000" valid_time_interval_unit="miliseconds">
			<output_level_1 name="tm_1_1" id="0" ifRef="0">
				<level1 format="DEFAULT"/>
				<level1_filter apply_def_filter="yes" extra_filter="TM_Filters/Level1/st01/asw_pus_v2_tm_1_1_filter.xml"/>
				<level0 format="DEFAULT"/>
				<level1_from_level0 import="DEFAULT"/>
				<level0_filter apply_def_filter="yes" extra_filter="NULL"/>
			</output_level_1>
			<output_level_2 name="tm_6_6_read_bytes" id="1" ifRef="0">
				<level2 format="TM_Formats/Level2/st06/asw_pus_tm_6_6_format.xml"/>
				<level2_filter apply_def_filter="no" extra_filter="TM_Filters/Level2/st06/asw_pus_tm_6_6_read_from_0x40001000_to_0x4000103F_filter.xml"/>
				<level1 format="DEFAULT"/>
 				<level2_from_level1 import="TM_Formats/Lv2_From_Lv1/st06/asw_pus_tm_6_6_from_asw_pus_v2_tm.xml"/>
				<level1_filter apply_def_filter="yes" extra_filter="TM_Filters/Level1/st06/asw_pus_v2_tm_6_6_filter.xml"/>
				<level0 format="DEFAULT"/>
				<level1_from_level0 import="DEFAULT"/>
				<level0_filter apply_def_filter="yes" extra_filter="NULL"/>
			</output_level_2>
			<output_level_1 name="tm_1_7" id="2" ifRef="0">
				<level1 format="DEFAULT"/>
				<level1_filter apply_def_filter="yes" extra_filter="TM_Filters/Level1/st01/asw_pus_v2_tm_1_7_filter.xml"/>
				<level0 format="DEFAULT"/>
				<level1_from_level0 import="DEFAULT"/>
				<level0_filter apply_def_filter="yes" extra_filter="NULL"/>
			</output_level_1>
		</outputs>			
	</step>
</test_proc>
