<?xml version="1.0" encoding="UTF-8"?>
<!DOCTYPE test_proc SYSTEM "../../DTDs/test_proc.dtd">

<test_proc name="tp_0011_asw_pus_tc_17_3_ob_connection_test">
	<step name="Send 17_3" id="0" prev_step_idref="NULL" output_idref_from_prev_step="NULL" mode="continuous">
		<inputs>
			<input_level_1 name="tc_17_3" ifRef="0" delay_value="120" delay_unit="miliseconds">
				<level2 format="TC_Formats/Level2/st17/asw_pus_tc_17_3_format.xml"/>
				<app_to_level2 export="STEPS_XML/INPUTS/tc_17_3/tc_17_3_ob_connection_test_apid_90.xml"/>
				<level1 format="DEFAULT"/>
				<app_to_level1 export="TC_Formats/Lv2_To_Lv1/st17/asw_pus_tc_17_3_to_asw_pus_v2_tc_ack_0b1001.xml"/>
				<level0 format="DEFAULT"/>
				<level1_to_level0 export="DEFAULT"/>
			</input_level_1>
		</inputs>
		<outputs checkmode="all" valid_time_interval_value="500" valid_time_interval_unit="miliseconds">
			<output_level_2 name="tm_1_2" id="0" ifRef="0">
				<level2 format="TM_Formats/Level2/st01/asw_pus_v2_tm_1_2_error_6_format.xml"/>
				<level2_filter apply_def_filter="no" extra_filter="TM_Filters/Level2/st01/asw_pus_tm_1_2_error_6_subtype_3_filter.xml"/>
 				<level2_from_level1 import="TM_Formats/Lv2_From_Lv1/st01/asw_pus_tm_1_2_from_asw_pus_v2_tm.xml"/>
				<level1 format="DEFAULT"/>
				<level1_filter apply_def_filter="yes" extra_filter="TM_Filters/Level1/st01/asw_pus_v2_tm_1_2_filter.xml"/>
				<level0 format="DEFAULT"/>
				<level1_from_level0 import="DEFAULT"/>
				<level0_filter apply_def_filter="yes" extra_filter="NULL"/>
			</output_level_2>
		</outputs>			
	</step>
</test_proc>
