<?xml version="1.0" encoding="UTF-8"?>
<!DOCTYPE test_proc SYSTEM "../../DTDs/test_proc.dtd">

<!--

ID: TP_0120_ASW_PUS_SERV_4_PARAM_STATS_REPORTING
Description:

The test checks that parameter statistics can be defined for Parameters 1 and 3
using TC(4,6), retrieved using TC(4,1), and that Parameter 3 statistics can be
deleted using TC(4,7), verifying the complete parameter statistics reporting
functionality. 

-->

<test_proc name="TP_0120_ASW_PUS_SERV_4_PARAM_STATS_REPORTING">
	<step name="tc_4_6" id="0" prev_step_idref="NULL" output_idref_from_prev_step="NULL" mode="continuous">
		<inputs>
			<input_level_2 name="tc_4_6" ifRef="0" delay_value="100" delay_unit="miliseconds">
				<level2 format="TC_Formats/Level2/st04/asw_pus_tc_4_6_format.xml"/>
				<app_to_level2 export="STEPS_XML/INPUTS/tc_4_6/tc_4_6_define_stats_PID_1.xml"/>
				<level1 format="DEFAULT"/>
				<level2_to_level1 export="TC_Formats/Lv2_To_Lv1/st04/asw_pus_tc_4_6_to_asw_pus_tc_ack.xml"/>
				<level0 format="DEFAULT"/>
				<level1_to_level0 export="DEFAULT"/>
			</input_level_2>
		</inputs>
		<outputs checkmode="all" valid_time_interval_value="500" valid_time_interval_unit="miliseconds">
			<output_level_1 name="tm_1_1" id="0" ifRef="0">
				<level1 format="DEFAULT"/>
				<level1_filter apply_def_filter="yes" extra_filter="TM_Filters/Level1/st01/asw_pus_v2_tm_1_1_filter.xml"/>
				<level0 format="DEFAULT"/>
				<level1_from_level0 import="DEFAULT"/>
				<level0_filter apply_def_filter="yes" extra_filter="NULL"/>
			</output_level_1>
			<output_level_1 name="tm_1_7" id="1" ifRef="0">
				<level1 format="DEFAULT"/>
				<level1_filter apply_def_filter="yes" extra_filter="TM_Filters/Level1/st01/asw_pus_v2_tm_1_7_filter.xml"/>
				<level0 format="DEFAULT"/>
				<level1_from_level0 import="DEFAULT"/>
				<level0_filter apply_def_filter="yes" extra_filter="NULL"/>
			</output_level_1>
		</outputs>			
	</step>
	<step name="tc_4_6" id="1" prev_step_idref="NULL" output_idref_from_prev_step="NULL" mode="continuous">
		<inputs>
			<input_level_2 name="tc_4_6" ifRef="0" delay_value="800" delay_unit="miliseconds">
				<level2 format="TC_Formats/Level2/st04/asw_pus_tc_4_6_format.xml"/>
				<app_to_level2 export="STEPS_XML/INPUTS/tc_4_6/tc_4_6_define_stats_PID_3.xml"/>
				<level1 format="DEFAULT"/>
				<level2_to_level1 export="TC_Formats/Lv2_To_Lv1/st04/asw_pus_tc_4_6_to_asw_pus_tc_ack.xml"/>
				<level0 format="DEFAULT"/>
				<level1_to_level0 export="DEFAULT"/>
			</input_level_2>
		</inputs>
		<outputs checkmode="all" valid_time_interval_value="500" valid_time_interval_unit="miliseconds">
			<output_level_1 name="tm_1_1" id="0" ifRef="0">
				<level1 format="DEFAULT"/>
				<level1_filter apply_def_filter="yes" extra_filter="TM_Filters/Level1/st01/asw_pus_v2_tm_1_1_filter.xml"/>
				<level0 format="DEFAULT"/>
				<level1_from_level0 import="DEFAULT"/>
				<level0_filter apply_def_filter="yes" extra_filter="NULL"/>
			</output_level_1>
			<output_level_1 name="tm_1_7" id="1" ifRef="0">
				<level1 format="DEFAULT"/>
				<level1_filter apply_def_filter="yes" extra_filter="TM_Filters/Level1/st01/asw_pus_v2_tm_1_7_filter.xml"/>
				<level0 format="DEFAULT"/>
				<level1_from_level0 import="DEFAULT"/>
				<level0_filter apply_def_filter="yes" extra_filter="NULL"/>
			</output_level_1>
		</outputs>			
	</step>
	<step name="tc_4_1" id="2" prev_step_idref="NULL" output_idref_from_prev_step="NULL" mode="continuous">
		<inputs>
			<input_level_1 name="tc_4_1" ifRef="0" delay_value="1400" delay_unit="miliseconds">
				<level1 format="DEFAULT"/>
				<app_to_level1 export="TC_Formats/Lv2_To_Lv1/st04/asw_pus_tc_4_1_to_asw_pus_tc_ack.xml"/>
				<level0 format="DEFAULT"/>
				<level1_to_level0 export="DEFAULT"/>
			</input_level_1>
		</inputs>
		<outputs checkmode="all" valid_time_interval_value="500" valid_time_interval_unit="miliseconds">
			<output_level_1 name="tm_1_1" id="0" ifRef="0">
				<level1 format="DEFAULT"/>
				<level1_filter apply_def_filter="yes" extra_filter="TM_Filters/Level1/st01/asw_pus_v2_tm_1_1_filter.xml"/>
				<level0 format="DEFAULT"/>
				<level1_from_level0 import="DEFAULT"/>
				<level0_filter apply_def_filter="yes" extra_filter="NULL"/>
			</output_level_1>
			<output_level_2 name="tm_4_2_stadistics_PID_1" id="1" ifRef="0">
				<level2 format="TM_Formats/Level2/st04/asw_pus_tm_4_2_format.xml"/>
				<level2_filter apply_def_filter="no" extra_filter="TM_Filters/Level2/st04/asw_pus_tm_4_2_PID_1_filter.xml"/>
				<level1 format="DEFAULT"/>
 				<level2_from_level1 import="TM_Formats/Lv2_From_Lv1/st04/asw_pus_tm_4_2_from_asw_pus_v2_tm.xml"/>
				<level1_filter apply_def_filter="yes" extra_filter="TM_Filters/Level1/st04/asw_pus_v2_tm_4_2_filter.xml"/>
				<level0 format="DEFAULT"/>
				<level1_from_level0 import="DEFAULT"/>
				<level0_filter apply_def_filter="yes" extra_filter="NULL"/>
			</output_level_2>
			<output_level_2 name="tm_4_2_stadistics_PID_3" id="2" ifRef="0">
				<level2 format="TM_Formats/Level2/st04/asw_pus_tm_4_2_format.xml"/>
				<level2_filter apply_def_filter="no" extra_filter="TM_Filters/Level2/st04/asw_pus_tm_4_2_PID_3_filter.xml"/>
				<level1 format="DEFAULT"/>
 				<level2_from_level1 import="TM_Formats/Lv2_From_Lv1/st04/asw_pus_tm_4_2_from_asw_pus_v2_tm.xml"/>
				<level1_filter apply_def_filter="yes" extra_filter="TM_Filters/Level1/st04/asw_pus_v2_tm_4_2_filter.xml"/>
				<level0 format="DEFAULT"/>
				<level1_from_level0 import="DEFAULT"/>
				<level0_filter apply_def_filter="yes" extra_filter="NULL"/>
			</output_level_2>
			<output_level_1 name="tm_1_7" id="3" ifRef="0">
				<level1 format="DEFAULT"/>
				<level1_filter apply_def_filter="yes" extra_filter="TM_Filters/Level1/st01/asw_pus_v2_tm_1_7_filter.xml"/>
				<level0 format="DEFAULT"/>
				<level1_from_level0 import="DEFAULT"/>
				<level0_filter apply_def_filter="yes" extra_filter="NULL"/>
			</output_level_1>
		</outputs>			
	</step>
	<step name="tc_4_7" id="3" prev_step_idref="NULL" output_idref_from_prev_step="NULL" mode="continuous">
		<inputs>
			<input_level_2 name="tc_4_7" ifRef="0" delay_value="2000" delay_unit="miliseconds">
				<level2 format="TC_Formats/Level2/st04/asw_pus_tc_4_7_format.xml"/>
				<app_to_level2 export="STEPS_XML/INPUTS/tc_4_7/tc_4_7_delete_stats_PID_3.xml"/>
				<level1 format="DEFAULT"/>
				<level2_to_level1 export="TC_Formats/Lv2_To_Lv1/st04/asw_pus_tc_4_7_to_asw_pus_tc_ack.xml"/>
				<level0 format="DEFAULT"/>
				<level1_to_level0 export="DEFAULT"/>
			</input_level_2>
		</inputs>
		<outputs checkmode="all" valid_time_interval_value="5000" valid_time_interval_unit="miliseconds">
			<output_level_1 name="tm_1_1" id="0" ifRef="0">
				<level1 format="DEFAULT"/>
				<level1_filter apply_def_filter="yes" extra_filter="TM_Filters/Level1/st01/asw_pus_v2_tm_1_1_filter.xml"/>
				<level0 format="DEFAULT"/>
				<level1_from_level0 import="DEFAULT"/>
				<level0_filter apply_def_filter="yes" extra_filter="NULL"/>
			</output_level_1>
			<output_level_1 name="tm_1_7" id="1" ifRef="0">
				<level1 format="DEFAULT"/>
				<level1_filter apply_def_filter="yes" extra_filter="TM_Filters/Level1/st01/asw_pus_v2_tm_1_7_filter.xml"/>
				<level0 format="DEFAULT"/>
				<level1_from_level0 import="DEFAULT"/>
				<level0_filter apply_def_filter="yes" extra_filter="NULL"/>
			</output_level_1>
		</outputs>			
	</step>
	<step name="tc_4_1" id="4" prev_step_idref="NULL" output_idref_from_prev_step="NULL" mode="continuous">
		<inputs>
			<input_level_1 name="tc_4_1" ifRef="0" delay_value="5000" delay_unit="miliseconds">
				<level1 format="DEFAULT"/>
				<app_to_level1 export="TC_Formats/Lv2_To_Lv1/st04/asw_pus_tc_4_1_to_asw_pus_tc_ack.xml"/>
				<level0 format="DEFAULT"/>
				<level1_to_level0 export="DEFAULT"/>
			</input_level_1>
		</inputs>
		<outputs checkmode="all" valid_time_interval_value="500" valid_time_interval_unit="miliseconds">
			<output_level_1 name="tm_1_1" id="0" ifRef="0">
				<level1 format="DEFAULT"/>
				<level1_filter apply_def_filter="yes" extra_filter="TM_Filters/Level1/st01/asw_pus_v2_tm_1_1_filter.xml"/>
				<level0 format="DEFAULT"/>
				<level1_from_level0 import="DEFAULT"/>
				<level0_filter apply_def_filter="yes" extra_filter="NULL"/>
			</output_level_1>
			<output_level_2 name="tm_4_2_stadistics_PID_1" id="1" ifRef="0">
				<level2 format="TM_Formats/Level2/st04/asw_pus_tm_4_2_format.xml"/>
				<level2_filter apply_def_filter="no" extra_filter="TM_Filters/Level2/st04/asw_pus_tm_4_2_PID_1_filter.xml"/>
				<level1 format="DEFAULT"/>
 				<level2_from_level1 import="TM_Formats/Lv2_From_Lv1/st04/asw_pus_tm_4_2_from_asw_pus_v2_tm.xml"/>
				<level1_filter apply_def_filter="yes" extra_filter="TM_Filters/Level1/st04/asw_pus_v2_tm_4_2_filter.xml"/>
				<level0 format="DEFAULT"/>
				<level1_from_level0 import="DEFAULT"/>
				<level0_filter apply_def_filter="yes" extra_filter="NULL"/>
			</output_level_2>
			<output_level_1 name="tm_1_7" id="2" ifRef="0">
				<level1 format="DEFAULT"/>
				<level1_filter apply_def_filter="yes" extra_filter="TM_Filters/Level1/st01/asw_pus_v2_tm_1_7_filter.xml"/>
				<level0 format="DEFAULT"/>
				<level1_from_level0 import="DEFAULT"/>
				<level0_filter apply_def_filter="yes" extra_filter="NULL"/>
			</output_level_1>
		</outputs>			
	</step>
</test_proc>
