<?xml version="1.0" encoding="UTF-8"?>
<!DOCTYPE test_proc SYSTEM "../DTDs/test_proc.dtd">

<!--

ID: TP_0110_ASW_PUS_TC_12_5_ADD_MON_DEF_PID_10
Description:

The test checks that a monitoring definition for Parameter 10 is added using
TC(12,5), enabled using TC(12,1), and that the monitoring system correctly
detects limit violations and generates the appropriate events.

-->


<test_proc name="TP_0110_ASW_PUS_TC_12_5_ADD_MON_DEF_PID_10">
	<step name="tc_20_3_set_pid_10_to_5" id="0" prev_step_idref="NULL" output_idref_from_prev_step="NULL" mode="continuous">
		<inputs>
			<input_level_2 name="tc_20_3" ifRef="0" delay_value="100" delay_unit="miliseconds">
				<level2 format="TC_Formats/Level2/st20/asw_pus_tc_20_3_uint32_format.xml"/>
				<app_to_level2 export="STEPS_XML/INPUTS/tc_20_3/tc_20_3_set_pid_10_to_99.xml"/>
				<level1 format="DEFAULT"/>
				<level2_to_level1 export="TC_Formats/Lv2_To_Lv1/st20/asw_pus_tc_20_3_uint32_to_asw_pus_tc_ack_0b1001.xml"/>
				<level0 format="DEFAULT"/>
				<level1_to_level0 export="DEFAULT"/>
			</input_level_2>
		</inputs>
		<outputs checkmode="all" valid_time_interval_value="500" valid_time_interval_unit="miliseconds">		
			<output_level_1 name="tm_1_1" id="0" ifRef="0">
				<level1 format="DEFAULT"/>
				<level1_filter apply_def_filter="yes" extra_filter="TM_Filters/Level1/st01/asw_pus_v2_tm_1_1_filter.xml"/>
				<level0 format="DEFAULT"/>
				<level1_from_level0 import="DEFAULT"/>
				<level0_filter apply_def_filter="yes" extra_filter="NULL"/>
			</output_level_1>
			<output_level_1 name="tm_1_7" id="1" ifRef="0">
				<level1 format="DEFAULT"/>
				<level1_filter apply_def_filter="yes" extra_filter="TM_Filters/Level1/st01/asw_pus_v2_tm_1_7_filter.xml"/>
				<level0 format="DEFAULT"/>
				<level1_from_level0 import="DEFAULT"/>
				<level0_filter apply_def_filter="yes" extra_filter="NULL"/>
			</output_level_1>
		</outputs>			
	</step>
	<step name="tc_12_5_add_pmonid0_pid_10_to_0x01_0x4000_10_0x4001" id="1" prev_step_idref="NULL" output_idref_from_prev_step="NULL" mode="continuous">
		<inputs>			
			<input_level_2 name="tc_12_5" ifRef="0" delay_value="800" delay_unit="miliseconds">
				<level2 format="TC_Formats/Level2/st12/asw_pus_tc_12_5_limits_uint32_format.xml"/>
				<app_to_level2 export="STEPS_XML/INPUTS/tc_12_05/tc_12_5_set_pmonid_0_to_pid_10_to_0x01_0x4000_0x0A_0x4001.xml"/>
				<level1 format="DEFAULT"/>
				<level2_to_level1 export="TC_Formats/Lv2_To_Lv1/st12/asw_pus_tc_12_5_to_asw_pus_tc_ack.xml"/>
				<level0 format="DEFAULT"/>
				<level1_to_level0 export="DEFAULT"/>
			</input_level_2>		
		</inputs>
		<outputs checkmode="all" valid_time_interval_value="500" valid_time_interval_unit="miliseconds">
			<output_level_1 name="tm_1_1" id="0" ifRef="0">
				<level1 format="DEFAULT"/>
				<level1_filter apply_def_filter="yes" extra_filter="TM_Filters/Level1/st01/asw_pus_v2_tm_1_1_filter.xml"/>
				<level0 format="DEFAULT"/>
				<level1_from_level0 import="DEFAULT"/>
				<level0_filter apply_def_filter="yes" extra_filter="NULL"/>
			</output_level_1>
			<output_level_1 name="tm_1_7" id="1" ifRef="0">
				<level1 format="DEFAULT"/>
				<level1_filter apply_def_filter="yes" extra_filter="TM_Filters/Level1/st01/asw_pus_v2_tm_1_7_filter.xml"/>
				<level0 format="DEFAULT"/>
				<level1_from_level0 import="DEFAULT"/>
				<level0_filter apply_def_filter="yes" extra_filter="NULL"/>
			</output_level_1>
		</outputs>			
	</step>
	<step name="tc_12_1_enable_pmon_id_0" 	id="2" prev_step_idref="NULL" output_idref_from_prev_step="NULL" mode="continuous">
		<inputs>			
			<input_level_2 name="tc_12_1" ifRef="0" delay_value="1400" delay_unit="miliseconds">
				<level2 format="TC_Formats/Level2/st12/asw_pus_tc_12_1_format.xml"/>
				<app_to_level2 export="STEPS_XML/INPUTS/tc_12_01/tc_12_1_enable_pmonid_0.xml"/>
				<level1 format="DEFAULT"/>
				<level2_to_level1 export="TC_Formats/Lv2_To_Lv1/st12/asw_pus_tc_12_1_to_asw_pus_tc_ack.xml"/>
				<level0 format="DEFAULT"/>
				<level1_to_level0 export="DEFAULT"/>
			</input_level_2>		
		</inputs>
		<outputs checkmode="all" valid_time_interval_value="500" valid_time_interval_unit="miliseconds">
			<output_level_1 name="tm_1_1" id="0" ifRef="0">
				<level1 format="DEFAULT"/>
				<level1_filter apply_def_filter="yes" extra_filter="TM_Filters/Level1/st01/asw_pus_v2_tm_1_1_filter.xml"/>
				<level0 format="DEFAULT"/>
				<level1_from_level0 import="DEFAULT"/>
				<level0_filter apply_def_filter="yes" extra_filter="NULL"/>
			</output_level_1>
			<output_level_1 name="tm_1_7" id="1" ifRef="0">
				<level1 format="DEFAULT"/>
				<level1_filter apply_def_filter="yes" extra_filter="TM_Filters/Level1/st01/asw_pus_v2_tm_1_7_filter.xml"/>
				<level0 format="DEFAULT"/>
				<level1_from_level0 import="DEFAULT"/>
				<level0_filter apply_def_filter="yes" extra_filter="NULL"/>
			</output_level_1>
		</outputs>			
	</step>
	<step name="tc_20_3_set_pid_10_to_99_force_0x4001_event" id="3" prev_step_idref="NULL" output_idref_from_prev_step="NULL" mode="continuous">
		<inputs>
			<input_level_2 name="tc_20_3" ifRef="0" delay_value="2000" delay_unit="miliseconds">
				<level2 format="TC_Formats/Level2/st20/asw_pus_tc_20_3_uint32_format.xml"/>
				<app_to_level2 export="STEPS_XML/INPUTS/tc_20_3/tc_20_3_set_pid_10_to_99.xml"/>
				<level1 format="DEFAULT"/>
				<level2_to_level1 export="TC_Formats/Lv2_To_Lv1/st20/asw_pus_tc_20_3_uint32_to_asw_pus_tc_ack_0b1001.xml"/>
				<level0 format="DEFAULT"/>
				<level1_to_level0 export="DEFAULT"/>
			</input_level_2>
		</inputs>
		<outputs checkmode="all" valid_time_interval_value="5000" valid_time_interval_unit="miliseconds">		
			<output_level_1 name="tm_1_1" id="0" ifRef="0">
				<level1 format="DEFAULT"/>
				<level1_filter apply_def_filter="yes" extra_filter="TM_Filters/Level1/st01/asw_pus_v2_tm_1_1_filter.xml"/>
				<level0 format="DEFAULT"/>
				<level1_from_level0 import="DEFAULT"/>
				<level0_filter apply_def_filter="yes" extra_filter="NULL"/>
			</output_level_1>
			<output_level_1 name="tm_1_7" id="1" ifRef="0">
				<level1 format="DEFAULT"/>
				<level1_filter apply_def_filter="yes" extra_filter="TM_Filters/Level1/st01/asw_pus_v2_tm_1_7_filter.xml"/>
				<level0 format="DEFAULT"/>
				<level1_from_level0 import="DEFAULT"/>
				<level0_filter apply_def_filter="yes" extra_filter="NULL"/>
			</output_level_1>
			<output_level_2 name="tm_12_12_monitoring_transition" id="2" ifRef="0">
				<level2 format="TM_Formats/Level2/st12/asw_pus_tm_12_12_limits_monitoring_format.xml"/>
				<level2_filter apply_def_filter="no" extra_filter="TM_Filters/Level2/st12/asw_pus_tm_12_12_limits_monitoring_filter_PMONID_0_PID_10.xml"/>
				<level1 format="DEFAULT"/>
 				<level2_from_level1 import="TM_Formats/Lv2_From_Lv1/st12/asw_pus_tm_12_12_from_asw_pus_v2_tm.xml"/>
				<level1_filter apply_def_filter="yes" extra_filter="TM_Filters/Level1/st12/asw_pus_v2_tm_12_12_filter.xml"/>
				<level0 format="DEFAULT"/>
				<level1_from_level0 import="DEFAULT"/>
				<level0_filter apply_def_filter="yes" extra_filter="NULL"/>
			</output_level_2>
			<output_level_2 name="tm_5_4_ev_id_equal_0x4001" id="3" ifRef="0">
				<level2 format="TM_Formats/Level2/st05/asw_pus_v2_tm_5_4_format.xml"/>
				<level2_filter apply_def_filter="no" extra_filter="TM_Filters/Level2/st05/asw_pus_tm_5_4_ev_id_equal_0x4001_filter.xml"/>
				<level1 format="DEFAULT"/>
 				<level2_from_level1 import="TM_Formats/Lv2_From_Lv1/st05/asw_pus_tm_5_4_from_asw_pus_v2_tm.xml"/>
				<level1_filter apply_def_filter="yes" extra_filter="TM_Filters/Level1/st05/asw_pus_v2_tm_5_4_filter.xml"/>
				<level0 format="DEFAULT"/>
				<level1_from_level0 import="DEFAULT"/>
				<level0_filter apply_def_filter="yes" extra_filter="NULL"/>
			</output_level_2>
		</outputs>			
	</step>
</test_proc>

