<?xml version="1.0" encoding="UTF-8"?>
<!DOCTYPE test_proc SYSTEM "../DTDs/test_proc.dtd">

<test_proc name="tp_0060_pus_tc_12_02_disable_pmonid_0">
	<step name="12_02_disable_pmonid_0" id="0" prev_step_idref="NULL" output_idref_from_prev_step="NULL" mode="continuous">
		<inputs>
			<input_level_2 name="tc_12_1" ifRef="0" delay_value="120" delay_unit="miliseconds">
				<level2 format="GSS_Interfaces/uart/TC_Formats/Level2/epd_pus_tc_12_2_format.xml"/>
				<app_to_level2 export="STEPS_XML/INPUTS/tc_12_02/tc_12_2_disable_pmonid_0.xml"/>
				<level1 format="DEFAULT"/>
				<level2_to_level1 export="GSS_Interfaces/uart/TC_Formats/Lv2_To_Lv1/epd_pus_tc_12_2_to_epd_pus_tc_ack.xml"/>
				<level0 format="DEFAULT"/>
				<level1_to_level0 export="DEFAULT"/>
			</input_level_2>
		</inputs>
		<outputs checkmode="all" valid_time_interval_value="500" valid_time_interval_unit="miliseconds">
			<output_level_1 name="tm_1_1" id="0" ifRef="0">
				<level1 format="DEFAULT"/>
				<level1_filter apply_def_filter="yes" extra_filter="GSS_Interfaces/uart/TM_Filters/Level1/epd_pus_tm_1_1_filter.xml"/>
				<level0 format="DEFAULT"/>
				<level1_from_level0 import="DEFAULT"/>
				<level0_filter apply_def_filter="yes" extra_filter="NULL"/>
			</output_level_1>
			<output_level_1 name="tm_1_7" id="1" ifRef="0">
				<level1 format="DEFAULT"/>
				<level1_filter apply_def_filter="yes" extra_filter="GSS_Interfaces/uart/TM_Filters/Level1/epd_pus_tm_1_7_filter.xml"/>
				<level0 format="DEFAULT"/>
				<level1_from_level0 import="DEFAULT"/>
				<level0_filter apply_def_filter="yes" extra_filter="NULL"/>
			</output_level_1>
		</outputs>			
	</step>
</test_proc>
